{
  "id": "MCPA-2026-0044",
  "title": "@dynatrace-oss/dynatrace-mcp-server create_dynatrace_notebook lacks the human-approval gate",
  "summary": "@dynatrace-oss/dynatrace-mcp-server (npm) before 1.8.7: the create_dynatrace_notebook write tool is missing the human-approval gate applied to the other write tools, letting a caller create persistent tenant-visible notebooks with arbitrary content \u2014 including embedded DQL that other users execute when opening the notebook \u2014 without operator consent. Fixed in 1.8.7.",
  "type": "overprivileged",
  "severity": "low",
  "aliases": [
    "GHSA-pc2w-4mq8-32qw"
  ],
  "cvss": {
    "vector": "CVSS:3.1/AV:N/AC:H/PR:N/UI:N/S:U/C:N/I:L/A:N",
    "score": 3.7
  },
  "cwe": [
    "CWE-862"
  ],
  "packages": [
    {
      "ecosystem": "npm",
      "name": "@dynatrace-oss/dynatrace-mcp-server",
      "ranges": [
        {
          "introduced": "0",
          "fixed": "1.8.7"
        }
      ]
    }
  ],
  "references": [
    {
      "type": "advisory",
      "url": "https://github.com/dynatrace-oss/dynatrace-mcp/security/advisories/GHSA-pc2w-4mq8-32qw"
    },
    {
      "type": "fix",
      "url": "https://github.com/dynatrace-oss/dynatrace-mcp/pull/529"
    },
    {
      "type": "web",
      "url": "https://github.com/dynatrace-oss/dynatrace-mcp/releases/tag/v1.8.7"
    }
  ],
  "timeline": {
    "published": "2026-07-29"
  }
}
