{
  "id": "MCPA-2026-0054",
  "title": "Flowise RCE via NodeVM sandbox escape through nodeVMOptions override (CVE-2026-69254)",
  "summary": "Flowise 3.1.2 and earlier let custom-code nodes override nodeVMOptions passed to executeJavaScriptCode(), escaping the NodeVM sandbox and executing arbitrary code on the host (reported by elttam). Fixed in 3.1.3.",
  "type": "rce-vectors",
  "severity": "critical",
  "aliases": [
    "CVE-2026-69254",
    "GHSA-3769-jgqc-cxm7"
  ],
  "cwe": [
    "CWE-94"
  ],
  "packages": [
    {
      "ecosystem": "npm",
      "name": "flowise",
      "ranges": [
        {
          "introduced": "0",
          "fixed": "3.1.3"
        }
      ]
    },
    {
      "ecosystem": "npm",
      "name": "flowise-components",
      "ranges": [
        {
          "introduced": "0",
          "fixed": "3.1.3"
        }
      ]
    }
  ],
  "references": [
    {
      "type": "advisory",
      "url": "https://github.com/advisories/GHSA-3769-jgqc-cxm7"
    },
    {
      "type": "advisory",
      "url": "https://github.com/FlowiseAI/Flowise/security/advisories/GHSA-3769-jgqc-cxm7"
    },
    {
      "type": "web",
      "url": "https://nvd.nist.gov/vuln/detail/CVE-2026-69254"
    }
  ],
  "timeline": {
    "published": "2026-08-04"
  }
}