{
  "id": "MCPA-2025-0007",
  "title": "mcp-server-kubernetes command injection in several kubectl tools (CVE-2025-53355)",
  "summary": "mcp-server-kubernetes before 2.5.0 builds kubectl command lines from unvalidated tool input and executes them with `child_process.execSync`, enabling shell metacharacter injection in tools such as `kubectl_scale`, `kubectl_patch`, and `explain_resource`. Indirect prompt injection via pod logs can chain into arbitrary command execution on the host running the server.",
  "type": "rce-vectors",
  "severity": "high",
  "aliases": ["CVE-2025-53355", "GHSA-gjv4-ghm7-q58q"],
  "cwe": ["CWE-78"],
  "packages": [
    {
      "ecosystem": "npm",
      "name": "mcp-server-kubernetes",
      "ranges": [{ "introduced": "0", "fixed": "2.5.0" }]
    }
  ],
  "references": [
    { "type": "advisory", "url": "https://github.com/Flux159/mcp-server-kubernetes/security/advisories/GHSA-gjv4-ghm7-q58q" },
    { "type": "advisory", "url": "https://github.com/advisories/GHSA-gjv4-ghm7-q58q" },
    { "type": "advisory", "url": "https://nvd.nist.gov/vuln/detail/CVE-2025-53355" }
  ],
  "timeline": {
    "published": "2025-07-08"
  }
}
