{
  "id": "MCPA-2026-0038",
  "title": "NetLicensing-MCP HTTP mode uses the server-side NetLicensing API key for unauthenticated requests (CVE-2026-54446)",
  "summary": "netlicensing-mcp (PyPI) through 0.1.5: in HTTP transport mode, ApiKeyMiddleware forwards requests that carry no client API key unconditionally, and the downstream HTTP client falls back to the server's own NetLicensing API key \u2014 unauthenticated remote callers act with the operator's full API privileges. Fixed in 0.1.6.",
  "type": "auth-missing",
  "severity": "high",
  "aliases": [
    "CVE-2026-54446",
    "GHSA-x9vc-9ffq-p3gj"
  ],
  "cvss": {
    "vector": "CVSS:3.1/AV:N/AC:H/PR:N/UI:N/S:U/C:H/I:H/A:H",
    "score": 8.1
  },
  "cwe": [
    "CWE-306"
  ],
  "packages": [
    {
      "ecosystem": "pypi",
      "name": "netlicensing-mcp",
      "ranges": [
        {
          "introduced": "0",
          "fixed": "0.1.6"
        }
      ]
    }
  ],
  "references": [
    {
      "type": "advisory",
      "url": "https://github.com/Labs64/NetLicensing-MCP/security/advisories/GHSA-x9vc-9ffq-p3gj"
    },
    {
      "type": "fix",
      "url": "https://github.com/Labs64/NetLicensing-MCP/commit/fbbb1d5ff88eb5400ec933a84e75601ebee48927"
    },
    {
      "type": "web",
      "url": "https://github.com/Labs64/NetLicensing-MCP/releases/tag/0.1.6"
    }
  ],
  "timeline": {
    "published": "2026-07-14"
  }
}
