{
  "id": "MCPA-2026-0013",
  "title": "Flyto2 Core SSRF guard bypass via IPv6 transition addresses (CVE-2026-55787)",
  "summary": "flyto-core before 2.26.3 validates outbound URLs in validate_url_ssrf but does not account for IPv6 transition addressing (IPv4-mapped, 6to4, NAT64), so requests that appear to target public IPv6 addresses can be routed to internal IPv4 hosts, bypassing the SSRF guard. Fixed in 2.26.3.",
  "type": "ssrf",
  "severity": "high",
  "aliases": ["CVE-2026-55787", "GHSA-794r-5rp2-fpg8", "PYSEC-2026-2481"],
  "cvss": { "vector": "CVSS:3.1/AV:N/AC:H/PR:L/UI:N/S:C/C:H/I:L/A:N", "score": 7.1 },
  "cwe": ["CWE-918"],
  "packages": [
    {
      "ecosystem": "pypi",
      "name": "flyto-core",
      "ranges": [{ "introduced": "0", "fixed": "2.26.3" }]
    }
  ],
  "references": [
    { "type": "advisory", "url": "https://github.com/advisories/GHSA-794r-5rp2-fpg8" },
    { "type": "web", "url": "https://osv.dev/vulnerability/PYSEC-2026-2481" },
    { "type": "web", "url": "https://nvd.nist.gov/vuln/detail/CVE-2026-55787" }
  ],
  "timeline": {
    "published": "2026-07-06"
  }
}
